{"role": "executor", "commit": "abc1234def567890abcdef1234567890abcdef12", "files_changed": ["src/cli/agents.rs", "src/cli/mod.rs", "src/cli/dynamic.rs", "src/main.rs", "agents/planner.md", "agents/plan-reviewer.md", "agents/executor.md", "agents/code-reviewer.md", "agents/guide.md", "tests/fixtures/agent_outputs/planner.json", "tests/fixtures/agent_outputs/plan-reviewer.json", "tests/fixtures/agent_outputs/executor.json", "tests/fixtures/agent_outputs/code-reviewer.json", "tests/fixtures/agent_outputs/guide.json"], "summary": "Implemented src/cli/agents.rs as a near-mechanical clone of cli/skills.rs with flat-file install surface. BUNDLED_AGENTS contains 5 entries (planner, plan-reviewer, executor, code-reviewer, guide) embedded via include_str!. Registered agents subcommand in dynamic.rs and dispatched in main.rs. All 5 cli::agents tests pass; cargo build succeeds."}
